wav/0000000041.wav|De lekkere hapjes en gezellige sfeer maken dat je altijd een leuke middag zult hebben.
wav/0000000037.wav|Het is heerlijk om met z'n allen te genieten en een verzorgd dagje te beleven zonder rennen, vliegen of koken.
wav/0000000017.wav|Met name cacaodoppen vinden katten onaangenaam, want zowel het knisperende geluid als de geur ervan vinden ze niet lekker.
wav/0000000016.wav|Met diepe droefheid heb ik kennis genomen van het overlijden van een goede vriend, maar gelukkig kan ik eerlijk zeggen dat hij een fantastisch leven heeft gehad.
wav/0000000020.wav|Niet alle tuinplanten die je normaal in de volle grond plant zijn geschikt voor het aanleggen van een verticale tuin buiten.
wav/0000000021.wav|Eenjarige lente en zomerbloeiers zijn uitermate geschikt voor plantenbakken en dus ook voor een verticale tuin.
wav/0000000036.wav|Hou het rustig in je tuin door voor veel van dezelfde planten te kiezen of voor verschillende soorten met alle dezelfde kleur bloemen.
wav/0000000001.wav|Vrijdagochtend trekken buien vanuit het zuidwesten naar het noordoosten en tussendoor komen ook enkele opklaringen voor.
wav/0000000030.wav|Vaak zul je merken dat je darmen even moeten wennen als je gezonder gaat eten.
wav/0000000047.wav|Het is één van de klassieke uitjes voor de hele familie die nog altijd razend populair zijn.
wav/0000000026.wav|Je komt alles te weten over hoe de magische instrumenten in staat zijn om helemaal automatisch al die prachtige muziekstukken ten gehore te brengen.
wav/0000000040.wav|Je leert alles over vallen en strikken, het volgen van diersporen, navigeren met een kaart en kompas en het maken van een vuur.
wav/0000000006.wav|Toen ik jong was, zagen wij elkaar veel vaker en gingen vaak samen op vakantie.
wav/0000000051.wav|Er is een tentoonstelling waarbij je voorwerpen kunt bekijken die echt in de ruimte zijn geweest.
wav/0000000050.wav|Het is reuze interessant om met het hele gezin naar een dierentuin te gaan in het weekend.
wav/0000000010.wav|Op het eiland zijn prachtige wandelingen te maken langs drie bijzondere vogelkijkhutten en een indrukwekkende uitkijktoren.
wav/0000000046.wav|Het is niet leuk voor ze als pap en mams alle puzzels oplossen en zij er maar voor spek en bonen bijzitten.
wav/0000000011.wav|Na een dag of twee zijn de koetjes en kalfjes wel uitgemolken, de nieuwtjes uitgewisseld en de directe omgeving verkend.
wav/0000000049.wav|Je ploegt eerst een tijdje door de golven en voelt de koele zeelucht en het zilte zeewater op je gezicht.
wav/0000000027.wav|Het ontstaan van ziektes heeft voor een groot deel te maken met een teveel aan suiker in je dieet.
wav/0000000007.wav|Om ons begrip over bliksemontladingen te vergroten en de daarmee gepaard gaande krachten en fysische processen in onweerswolken, kunnen we verschillende instrumenten en technieken gebruiken.
wav/0000000031.wav|Je leert allemaal handige overlevingstechnieken die je normaal gesproken nooit nodig zult hebben, maar die heel goed van pas kunnen komen.
wav/0000000008.wav|Je kunt hier uren ronddwalen en op zoek gaan naar wilde dieren als runderen, edelherten, vossen of de wilde paarden met hun veulens.
wav/0000000032.wav|Wanneer je goed slaapt, zul je merken dat je je snel actiever en gemotiveerder voelt als je je eetpatroon omgooit en verbetert.
wav/0000000024.wav|Met een goed eetpatroon kun je een deel van dat ongemak echter vrij eenvoudig voorkomen.
wav/0000000004.wav|Wanneer ik lekker aan het koken ben, vergeet ik alles en iedereen om mij heen.
wav/0000000012.wav|Uit grootschalig onderzoek blijkt dat meer mensen dit jaar de voorkeur geven aan een vakantie in eigen land.
wav/0000000045.wav|Dat is echt leuk voor de hele familie, want niet alleen ben je lekker in de buitenlucht met elkaar bezig maar je komt ook tal van hindernissen tegen.
wav/0000000028.wav|De wetenschappers willen nog verder onderzoek doen naar hoe de plant in verre van ideale omstandigheden zo lang heeft kunnen groeien.
wav/0000000029.wav|De regels zijn streng maar rechtvaardig en wie het beste in staat is in zijn rol te blijven maakt de meeste kans het spel te winnen.
wav/0000000013.wav|De parken beschikken over vele uitstekende faciliteiten om een vakantie met gezin compleet te maken.
wav/0000000044.wav|Midden in de wildernis leer je met de hele familie hoe het is om afhankelijk te zijn van de natuur onder begeleiding van een echte expert.
wav/0000000005.wav|Ik voel dat ik er klaar voor ben en wil dit jaar ook weer meedoen met hardloopwedstrijden.
wav/0000000052.wav|Een rondvaart met de kinderen is een echte aanrader omdat het leuk is om de stad eens vanaf het water te bekijken.
wav/0000000033.wav|Hoe beter je eet, hoe beter je lichaam in staat is om goed te blijven herstellen en hoe minder je achteruit gaat als je ouder wordt.
wav/0000000009.wav|Nergens ter wereld is er zoveel landschapskunst te vinden op zo’n klein oppervlak als hier.
wav/0000000048.wav|Met een groep van maximaal tien personen zul je plaatsnemen op een rubberen ribboot, die zeer hoge snelheden kan behalen.
wav/0000000025.wav|Elk familielid kan zijn creativiteit en muzikale talent de vrije loop laten want voor iedereen is er wel een spetterende rol weggelegd in jullie eigen productie.
wav/0000000014.wav|Bereid de lekkerste gerechten in de keuken, kijk een filmpje in de sfeervolle woonkamer en drink een lekker kopje koffie.
wav/0000000002.wav|De Europese voetbalbond probeert al jaren een nieuw stadion te bouwen met vele lichten en groene velden.
wav/0000000043.wav|Vaak kan er ook voor of achteraf lekker ter plekke worden gegeten, maar je kunt natuurlijk ook naderhand een restaurant in de buurt opzoeken.
wav/0000000038.wav|Een rondje lopen is altijd leuk voor jong en oud, maar natuurlijk niet heel origineel.
wav/0000000018.wav|Groentesoorten die veel vocht bevatten, zoals komkommer, tomaat en sla, worden er niet lekkerder op in de vriezer.
wav/0000000034.wav|Eet je te weinig verse groente, dan kan het zijn dat je huid relatief sneller zijn veerkracht verliest.
wav/0000000022.wav|Door het geringe gewicht is het risico van deze kleine drones beperkt: de kans op ernstig letsel is klein.
wav/0000000023.wav|Voor iedereen die het lastig vindt om voldoende water te drinken, kan het snacken van watermeloen een goeie aanvulling zijn op zijn dieet.
wav/0000000019.wav|Rauwe aardappels kun je beter niet in de vriezer bewaren, omdat ze veel vocht bevatten.
wav/0000000035.wav|Stress is een veelvoorkomende oorzaak van slecht slapen waarbij je leefstijl en tijdsindeling een belangrijke rol spelen.
wav/0000000039.wav|Met aansluitend een lekker diner of bijvoorbeeld een heerlijke koffie sluit je de dag perfect af.
wav/0000000003.wav|Na jaren van werk beginnen we geleidelijk samen te werken om het klimaat te redden en te verbeteren.
wav/0000000042.wav|Beleef het boerenleven eens op een leuke en originele manier door midden tussen de landerijen een potje boerengolf te spelen.
wav/0000000015.wav|Als het één keer volle maan is geweest na de geboorte van een gezond kind, wordt er een feest georganiseerd door de familie.
